{
  "schema_version" : "1.0.0",
  "run_id" : "RUN-01M293KJ0RYV603B3JB0CCJJN9",
  "attempt_id" : "01M293KJG55B1BR5B5RV0V29VJ",
  "stage_id" : "00-bootstrap",
  "stage_name" : "RunBootstrap",
  "edge_id" : null,
  "purpose" : "Infrastructure preflight: validate the input path, gate the harness bill of materials against OSS policy, create the run identity and workspaces, snapshot the source and initialise the artifact, evidence and state planes. Makes no migration decision.",
  "trigger" : "PIPELINE",
  "trigger_detail" : null,
  "started_at" : "2026-09-11T20:47:35.941203100Z",
  "finished_at" : "2026-09-11T20:47:37.802149700Z",
  "duration_ms" : 1860,
  "state_before" : "CREATED",
  "state_after" : "OSS_POLICY_VERIFIED",
  "status" : "SUCCESS",
  "summary" : "Workspaces created under C:\\Users\\annav\\AppData\\Local\\Temp\\bootshift-workspaces\\RUN-01M293KJ0RYV603B3JB0CCJJN9; OSS gate passed for 19 harness components",
  "attempt_directory" : "20260911-204737-712",
  "declared_preconditions" : [ ],
  "precondition_results" : [ ],
  "declared_inputs" : [ ],
  "resolved_inputs" : [ ],
  "declared_steps" : [ "BOOT-001", "BOOT-002", "BOOT-003", "BOOT-004", "BOOT-005", "BOOT-006", "BOOT-007", "BOOT-008", "BOOT-009", "BOOT-010" ],
  "executed_steps" : [ {
    "step_id" : "BOOT-001",
    "sequence" : 1,
    "name" : "Resolve and validate source root",
    "purpose" : "Refuse a path that is not a directory before anything is created",
    "status" : "SUCCESS",
    "status_reason" : "Input path accepted",
    "started_at" : "2026-09-11T20:47:35.941203100Z",
    "finished_at" : "2026-09-11T20:47:35.941203100Z",
    "duration_ms" : 0,
    "inputs" : [ ],
    "outputs" : [ ],
    "evidence_refs" : [ ],
    "details" : {
      "source_root" : "E:\\Virtusa Projects\\bootshift\\src"
    },
    "error" : null
  }, {
    "step_id" : "BOOT-002",
    "sequence" : 2,
    "name" : "Gate the harness bill of materials",
    "purpose" : "Every component the harness itself loads is checked against the OSS policy",
    "status" : "SUCCESS",
    "status_reason" : "Every declared component passes the OSS gate",
    "started_at" : "2026-09-11T20:47:35.941203100Z",
    "finished_at" : "2026-09-11T20:47:35.944768200Z",
    "duration_ms" : 3,
    "inputs" : [ ],
    "outputs" : [ ],
    "evidence_refs" : [ ],
    "details" : {
      "components_checked" : 19,
      "blocking_findings" : 0
    },
    "error" : null
  }, {
    "step_id" : "BOOT-003",
    "sequence" : 3,
    "name" : "Probe for forbidden recipe estates on the classpath",
    "purpose" : "A declared coordinate list cannot see what arrived transitively",
    "status" : "SUCCESS",
    "status_reason" : "No forbidden recipe estate is loadable",
    "started_at" : "2026-09-11T20:47:35.944768200Z",
    "finished_at" : "2026-09-11T20:47:35.944768200Z",
    "duration_ms" : 0,
    "inputs" : [ ],
    "outputs" : [ ],
    "evidence_refs" : [ ],
    "details" : {
      "markers_probed" : 4,
      "loadable" : 0
    },
    "error" : null
  }, {
    "step_id" : "BOOT-004",
    "sequence" : 4,
    "name" : "Create run workspaces",
    "purpose" : "original, migration, runtime-old, runtime-new, checkpoint, evidence and state",
    "status" : "SUCCESS",
    "status_reason" : "Run workspaces created",
    "started_at" : "2026-09-11T20:47:35.944768200Z",
    "finished_at" : "2026-09-11T20:47:35.944768200Z",
    "duration_ms" : 0,
    "inputs" : [ ],
    "outputs" : [ ],
    "evidence_refs" : [ ],
    "details" : {
      "workspace_root" : "C:\\Users\\annav\\AppData\\Local\\Temp\\bootshift-workspaces\\RUN-01M293KJ0RYV603B3JB0CCJJN9"
    },
    "error" : null
  }, {
    "step_id" : "BOOT-005",
    "sequence" : 5,
    "name" : "Capture source provenance",
    "purpose" : "Records what was handed to the harness, independently of what it becomes",
    "status" : "SUCCESS",
    "status_reason" : "Source provenance captured",
    "started_at" : "2026-09-11T20:47:35.944768200Z",
    "finished_at" : "2026-09-11T20:47:36.056019600Z",
    "duration_ms" : 111,
    "inputs" : [ ],
    "outputs" : [ ],
    "evidence_refs" : [ ],
    "details" : {
      "kind" : "PLAIN_DIRECTORY"
    },
    "error" : null
  }, {
    "step_id" : "BOOT-006",
    "sequence" : 6,
    "name" : "Snapshot source into original and migration workspaces",
    "purpose" : "Both snapshots must hash identically or the run cannot be trusted",
    "status" : "SUCCESS",
    "status_reason" : "Original and migration snapshots agree",
    "started_at" : "2026-09-11T20:47:36.056019600Z",
    "finished_at" : "2026-09-11T20:47:36.513001200Z",
    "duration_ms" : 456,
    "inputs" : [ ],
    "outputs" : [ ],
    "evidence_refs" : [ ],
    "details" : {
      "snapshot_hash" : "f48b7888b0016061a2d693686412a2d04822aa14c81c506114f9392c6bc8687b"
    },
    "error" : null
  }, {
    "step_id" : "BOOT-007",
    "sequence" : 7,
    "name" : "Initialise the internal checkpoint repository",
    "purpose" : "Checkpoint history lives in the external workspace, never in the user input",
    "status" : "SUCCESS",
    "status_reason" : "Checkpoint repository initialised",
    "started_at" : "2026-09-11T20:47:36.513001200Z",
    "finished_at" : "2026-09-11T20:47:37.672037700Z",
    "duration_ms" : 1159,
    "inputs" : [ ],
    "outputs" : [ ],
    "evidence_refs" : [ ],
    "details" : { },
    "error" : null
  }, {
    "step_id" : "BOOT-008",
    "sequence" : 8,
    "name" : "Mark the original workspace read-only",
    "purpose" : "The immutable side of the differential must not be writable",
    "status" : "SUCCESS",
    "status_reason" : "Original workspace marked read-only",
    "started_at" : "2026-09-11T20:47:37.672037700Z",
    "finished_at" : "2026-09-11T20:47:37.703561400Z",
    "duration_ms" : 31,
    "inputs" : [ ],
    "outputs" : [ ],
    "evidence_refs" : [ ],
    "details" : { },
    "error" : null
  }, {
    "step_id" : "BOOT-009",
    "sequence" : 9,
    "name" : "Initialise the run state store",
    "purpose" : "Creates the run record the state machine writes to",
    "status" : "SUCCESS",
    "status_reason" : "Run state store initialised",
    "started_at" : "2026-09-11T20:47:37.703561400Z",
    "finished_at" : "2026-09-11T20:47:37.712048300Z",
    "duration_ms" : 8,
    "inputs" : [ ],
    "outputs" : [ ],
    "evidence_refs" : [ ],
    "details" : { },
    "error" : null
  }, {
    "step_id" : "BOOT-010",
    "sequence" : 10,
    "name" : "Publish the bootstrap artifact and OSS licence gate",
    "purpose" : "Proves WORKSPACE_READY and OSS_POLICY_VERIFIED to every later precondition",
    "status" : "SUCCESS",
    "status_reason" : "Published and pointer advanced",
    "started_at" : "2026-09-11T20:47:37.712048300Z",
    "finished_at" : "2026-09-11T20:47:37.795227Z",
    "duration_ms" : 83,
    "inputs" : [ ],
    "outputs" : [ ],
    "evidence_refs" : [ ],
    "details" : { },
    "error" : null
  } ],
  "unexecuted_steps" : [ ],
  "commands" : [ ],
  "tool_invocations" : [ ],
  "decisions" : [ ],
  "evidence_references" : [ ],
  "document_references" : [ ],
  "migration_fact_references" : [ ],
  "impact_references" : [ ],
  "mutation_summary" : { },
  "validation_summary" : { },
  "retries" : [ ],
  "fallbacks" : [ ],
  "warnings" : [ "Input path is inside the harness repository; harness modules are excluded from analysis by the module filter." ],
  "errors" : [ ],
  "blind_spots" : [ ],
  "outputs" : [ {
    "name" : "bootstrap.json",
    "path" : "E:\\Virtusa Projects\\bootshift\\output-fresh\\00-bootstrap\\20260911-204737-712\\bootstrap.json",
    "hash" : "252ceecb954491e0c4abd4f22213620f1d0901c481027ff4f90005d33152438b"
  } ],
  "metrics" : { },
  "primary_artifact_hash" : "729611458",
  "next_action" : "Run: bootshift inventory --repo <path>",
  "stop_reason" : null,
  "policy_hash" : "401ab5afe78e1845245b5095d6ca38f6f383d9e270e2744a090d8b0e885f40db",
  "tool_version" : "1.0.0",
  "rendering_error" : null
}
